{
  "schemaVersion": 1,
  "startedAtUtc": "2026-08-10T00:00:00Z",
  "completedAtUtc": "2026-08-10T00:00:01Z",
  "mode": "DRY_RUN",
  "verdict": "PARTIAL",
  "beforeAfterFingerprint": "MATCH",
  "caseTotal": 0,
  "passCount": 0,
  "failCount": 0,
  "notRunCount": 0,
  "cleanupOutcome": "NOT_RUN",
  "cleanupFailureCode": "NONE",
  "cases": []
}
